{
  "id": "cline",
  "name": "Cline",
  "version": "3.0.15",
  "description": "Autonomous coding agent CLI - capable of creating/editing files, running commands, using the browser, and more",
  "repository": "https://github.com/cline/cline",
  "website": "https://cline.bot/cli",
  "authors": [
    "Cline Bot Inc."
  ],
  "license": "Apache-2.0",
  "icon": "./icon.svg",
  "distribution": {
    "npx": {
      "package": "cline@3.0.15",
      "args": [
        "--acp"
      ]
    }
  }
}
