{
  "id": "dirac",
  "name": "Dirac",
  "version": "0.4.11",
  "description": "Reduces API costs by more than 50%, produces better and faster work. Uses Hash anchored parallel edits, AST manipulation and a whole lot of neat optimizations. Fully Open Source.",
  "repository": "https://github.com/dirac-run/dirac",
  "website": "https://dirac.run",
  "authors": [
    "Dirac Delta Labs"
  ],
  "license": "Apache-2.0",
  "icon": "./icon.svg",
  "distribution": {
    "npx": {
      "package": "dirac-cli@0.4.11",
      "args": [
        "--acp"
      ]
    }
  }
}
