{
  "id": "dimcode",
  "name": "DimCode",
  "version": "0.0.74",
  "description": "A coding agent that puts leading models at your command.",
  "website": "https://dimcode.dev/docs/acp.html",
  "authors": [
    "ArcShips"
  ],
  "license": "proprietary",
  "distribution": {
    "npx": {
      "package": "dimcode@0.0.74",
      "args": [
        "acp"
      ]
    }
  }
}
