{
  "id": "opencode",
  "name": "OpenCode",
  "version": "1.18.3",
  "description": "The open source coding agent",
  "repository": "https://github.com/anomalyco/opencode",
  "website": "https://opencode.ai",
  "authors": [
    "Anomaly"
  ],
  "license": "MIT",
  "icon": "./icon.svg",
  "distribution": {
    "binary": {
      "darwin-aarch64": {
        "archive": "https://github.com/anomalyco/opencode/releases/download/v1.18.3/opencode-darwin-arm64.zip",
        "cmd": "./opencode",
        "args": [
          "acp"
        ],
        "sha256": "946f62b155638b911144b7bef520ee4a6442f696297907873463bca3524e40ef"
      },
      "darwin-x86_64": {
        "archive": "https://github.com/anomalyco/opencode/releases/download/v1.18.3/opencode-darwin-x64.zip",
        "cmd": "./opencode",
        "args": [
          "acp"
        ],
        "sha256": "4ea147867ba19e4ec03559df557811f1674f40788aea4d10326dc563b7667c6d"
      },
      "linux-aarch64": {
        "archive": "https://github.com/anomalyco/opencode/releases/download/v1.18.3/opencode-linux-arm64.tar.gz",
        "cmd": "./opencode",
        "args": [
          "acp"
        ],
        "sha256": "da0a631174eba380b2a1d51f9d364fa3812da433e72743c72471d4b5da59c69d"
      },
      "linux-x86_64": {
        "archive": "https://github.com/anomalyco/opencode/releases/download/v1.18.3/opencode-linux-x64.tar.gz",
        "cmd": "./opencode",
        "args": [
          "acp"
        ],
        "sha256": "60f27b2679f00a511b6539f97e02448afaf58d9c66e2448285ea0c517ca84583"
      },
      "windows-aarch64": {
        "archive": "https://github.com/anomalyco/opencode/releases/download/v1.18.3/opencode-windows-arm64.zip",
        "cmd": "./opencode",
        "args": [
          "acp"
        ],
        "sha256": "a549fb2e9041db9438bcd9b77bfa0a4b2476caf2d550f37479aabfec1b079bfb"
      },
      "windows-x86_64": {
        "archive": "https://github.com/anomalyco/opencode/releases/download/v1.18.3/opencode-windows-x64.zip",
        "cmd": "./opencode.exe",
        "args": [
          "acp"
        ],
        "sha256": "68bc62930f6cb5755e0409aa9de0bb270a66ed2b8c9cf0c029e9f2287ed5486e"
      }
    }
  }
}
