{
  "id": "codex-acp",
  "name": "Codex",
  "version": "1.0.2",
  "description": "ACP adapter for OpenAI's coding assistant",
  "repository": "https://github.com/agentclientprotocol/codex-acp",
  "authors": [
    "OpenAI",
    "JetBrains s.r.o",
    "Zed Industries"
  ],
  "license": "Apache-2.0",
  "distribution": {
    "npx": {
      "package": "@agentclientprotocol/codex-acp@1.0.2"
    }
  }
}
