{
  "id": "junie",
  "name": "Junie",
  "version": "2383.9.0",
  "description": "AI Coding Agent by JetBrains",
  "repository": "https://github.com/JetBrains/junie",
  "website": "https://junie.jetbrains.com",
  "authors": ["JetBrains"],
  "license": "proprietary",
  "distribution": {
    "binary": {
      "darwin-aarch64": {
        "archive": "https://github.com/JetBrains/junie/releases/download/2383.9/junie-release-2383.9-macos-aarch64.zip",
        "cmd": "./Applications/junie.app/Contents/MacOS/junie",
        "args": ["--acp=true"]
      },
      "darwin-x86_64": {
        "archive": "https://github.com/JetBrains/junie/releases/download/2383.9/junie-release-2383.9-macos-amd64.zip",
        "cmd": "./Applications/junie.app/Contents/MacOS/junie",
        "args": ["--acp=true"]
      },
      "linux-aarch64": {
        "archive": "https://github.com/JetBrains/junie/releases/download/2383.9/junie-release-2383.9-linux-aarch64.zip",
        "cmd": "./junie-app/bin/junie",
        "args": ["--acp=true"]
      },
      "linux-x86_64": {
        "archive": "https://github.com/JetBrains/junie/releases/download/2383.9/junie-release-2383.9-linux-amd64.zip",
        "cmd": "./junie-app/bin/junie",
        "args": ["--acp=true"]
      },
      "windows-x86_64": {
        "archive": "https://github.com/JetBrains/junie/releases/download/2383.9/junie-release-2383.9-windows-amd64.zip",
        "cmd": "./junie/junie.exe",
        "args": ["--acp=true"]
      }
    }
  }
}
