{
  "id": "kilo",
  "name": "Kilo",
  "version": "7.4.5",
  "description": "The open source coding agent",
  "repository": "https://github.com/Kilo-Org/kilocode",
  "website": "https://kilo.ai/",
  "authors": [
    "Kilo Code"
  ],
  "license": "MIT",
  "icon": "./icon.svg",
  "distribution": {
    "binary": {
      "darwin-aarch64": {
        "archive": "https://github.com/Kilo-Org/kilocode/releases/download/v7.4.5/kilo-darwin-arm64.zip",
        "cmd": "./kilo",
        "args": [
          "acp"
        ]
      },
      "darwin-x86_64": {
        "archive": "https://github.com/Kilo-Org/kilocode/releases/download/v7.4.5/kilo-darwin-x64.zip",
        "cmd": "./kilo",
        "args": [
          "acp"
        ]
      },
      "linux-aarch64": {
        "archive": "https://github.com/Kilo-Org/kilocode/releases/download/v7.4.5/kilo-linux-arm64.tar.gz",
        "cmd": "./kilo",
        "args": [
          "acp"
        ]
      },
      "linux-x86_64": {
        "archive": "https://github.com/Kilo-Org/kilocode/releases/download/v7.4.5/kilo-linux-x64.tar.gz",
        "cmd": "./kilo",
        "args": [
          "acp"
        ]
      },
      "windows-x86_64": {
        "archive": "https://github.com/Kilo-Org/kilocode/releases/download/v7.4.5/kilo-windows-x64.zip",
        "cmd": "./kilo.exe",
        "args": [
          "acp"
        ]
      }
    },
    "npx": {
      "package": "@kilocode/cli@7.4.5",
      "args": [
        "acp"
      ]
    }
  }
}
