{
  "id": "cursor",
  "name": "Cursor",
  "version": "2026.05.28",
  "description": "Cursor's coding agent",
  "website": "https://cursor.com/docs/cli/acp",
  "authors": ["Cursor"],
  "license": "proprietary",
  "distribution": {
    "binary": {
      "darwin-aarch64": {
        "archive": "https://downloads.cursor.com/lab/2026.05.28-a70ca7c/darwin/arm64/agent-cli-package.tar.gz",
        "cmd": "./dist-package/cursor-agent",
        "args": ["acp"]
      },
      "darwin-x86_64": {
        "archive": "https://downloads.cursor.com/lab/2026.05.28-a70ca7c/darwin/x64/agent-cli-package.tar.gz",
        "cmd": "./dist-package/cursor-agent",
        "args": ["acp"]
      },
      "linux-aarch64": {
        "archive": "https://downloads.cursor.com/lab/2026.05.28-a70ca7c/linux/arm64/agent-cli-package.tar.gz",
        "cmd": "./dist-package/cursor-agent",
        "args": ["acp"]
      },
      "linux-x86_64": {
        "archive": "https://downloads.cursor.com/lab/2026.05.28-a70ca7c/linux/x64/agent-cli-package.tar.gz",
        "cmd": "./dist-package/cursor-agent",
        "args": ["acp"]
      },
      "windows-aarch64": {
        "archive": "https://downloads.cursor.com/lab/2026.05.28-a70ca7c/windows/arm64/agent-cli-package.zip",
        "cmd": "./dist-package\\cursor-agent.cmd",
        "args": ["acp"]
      },
      "windows-x86_64": {
        "archive": "https://downloads.cursor.com/lab/2026.05.28-a70ca7c/windows/x64/agent-cli-package.zip",
        "cmd": "./dist-package\\cursor-agent.cmd",
        "args": ["acp"]
      }
    }
  }
}
