{
  "id": "harn",
  "name": "Harn",
  "version": "0.10.5",
  "description": "Harn runs .harn agent pipelines as a native ACP coding agent over stdio.",
  "repository": "https://github.com/burin-labs/harn",
  "website": "https://harnlang.com",
  "authors": [
    "Burin Labs"
  ],
  "license": "Apache-2.0",
  "distribution": {
    "binary": {
      "darwin-aarch64": {
        "archive": "https://github.com/burin-labs/harn/releases/download/v0.10.5/harn-aarch64-apple-darwin.tar.gz",
        "cmd": "./harn",
        "args": [
          "serve",
          "acp"
        ]
      },
      "darwin-x86_64": {
        "archive": "https://github.com/burin-labs/harn/releases/download/v0.10.5/harn-x86_64-apple-darwin.tar.gz",
        "cmd": "./harn",
        "args": [
          "serve",
          "acp"
        ]
      },
      "linux-aarch64": {
        "archive": "https://github.com/burin-labs/harn/releases/download/v0.10.5/harn-aarch64-unknown-linux-gnu.tar.gz",
        "cmd": "./harn",
        "args": [
          "serve",
          "acp"
        ]
      },
      "linux-x86_64": {
        "archive": "https://github.com/burin-labs/harn/releases/download/v0.10.5/harn-x86_64-unknown-linux-gnu.tar.gz",
        "cmd": "./harn",
        "args": [
          "serve",
          "acp"
        ]
      },
      "windows-x86_64": {
        "archive": "https://github.com/burin-labs/harn/releases/download/v0.10.5/harn-x86_64-pc-windows-msvc.zip",
        "cmd": "harn.exe",
        "args": [
          "serve",
          "acp"
        ]
      }
    }
  }
}
