{
  "id": "grok-build",
  "name": "Grok Build",
  "version": "0.2.58",
  "description": "xAI's coding agent and CLI",
  "website": "https://x.ai/cli",
  "authors": [
    "xAI"
  ],
  "license": "proprietary",
  "distribution": {
    "npx": {
      "package": "@xai-official/grok@0.2.58",
      "args": [
        "agent",
        "stdio"
      ]
    }
  }
}
